"entity","name","label","dataType","refEntity","mappedBy","nillable","idAttribute","enumOptions","defaultValue","rangeMin","rangeMax","lookupAttribute","labelAttribute","readOnly","aggregateable","visible","unique","partOfAttribute","expression","validationExpression","tags","description","description-en","label-en","description-nl","label-nl","description-pt","label-pt","description-es","label-es","description-de","label-de","description-it","label-it","description-fr","label-fr","description-xx","label-xx""eu_bbmri_eric_biobank_size","id","id","int","","","FALSE","TRUE","","","","","TRUE","FALSE","TRUE","FALSE","TRUE","TRUE","","","","","Unique ID.","","","","","","","","","","","","","","","","""eu_bbmri_eric_biobank_size","size","size","string","","","FALSE","FALSE","","","","","FALSE","TRUE","FALSE","FALSE","TRUE","FALSE","","","","","Size of the collection measured as 10n samples.","","","","","","","","","","","","","","","","""eu_bbmri_eric_biobanks","id","id","string","","","FALSE","TRUE","","","","","TRUE","FALSE","TRUE","FALSE","FALSE","TRUE","","","","","Unique biobank ID within BBMRI-ERIC based on MIABIS 2.0 standard (ISO 3166-1 alpha-2 + underscore + biobank national ID or name), prefixed with bbmri-eric:ID: string - MIABIS-2.0-01.","","","","","","","","","","","","","","","","""eu_bbmri_eric_biobanks","name","name","string","","","FALSE","FALSE","","","","","TRUE","TRUE","FALSE","FALSE","TRUE","FALSE","","","","","Biobank name according to MIABIS 2.0 - MIABIS-2.0-03.","","","","","","","","","","","","","","","","""eu_bbmri_eric_biobanks","acronym","acronym","string","","","TRUE","FALSE","","","","","TRUE","FALSE","FALSE","FALSE","TRUE","FALSE","","","","","Biobank acronym - MIABIS-2.0-02.","","","","","","","","","","","","","","","","""eu_bbmri_eric_biobanks","description","description","text","","","TRUE","FALSE","","","","","FALSE","FALSE","FALSE","FALSE","FALSE","FALSE","","","","","Biobank description - MIABIS-2.0-08.","","","","","","","","","","","","","","","","""eu_bbmri_eric_biobanks","bioresource_reference","bioresource reference","text","","","TRUE","FALSE","","","","","FALSE","FALSE","FALSE","FALSE","FALSE","FALSE","","","","","Bioresource reference to be cited when the bioresource (biobank/collection) is used for research.","","","","","","","","","","","","","","","","""eu_bbmri_eric_biobanks","url","url","hyperlink","","","TRUE","FALSE","","","","","FALSE","FALSE","FALSE","FALSE","TRUE","FALSE","","","","","Biobank URL - MIABIS-2.0-04.","","","","","","","","","","","","","","","","""eu_bbmri_eric_biobanks","juridical_person","juridical person","string","","","FALSE","FALSE","","","","","FALSE","FALSE","FALSE","FALSE","TRUE","FALSE","","","","","Juristic person of a biobank according to MIABIS 2.0 - MIABIS-2.0-05.","","","","","","","","","","","","","","","","""eu_bbmri_eric_biobanks","country","country","xref","eu_bbmri_eric_countries","","FALSE","FALSE","","","","","FALSE","FALSE","FALSE","FALSE","TRUE","FALSE","","","","","Country hosting the biobank according to MIABIS 2.0 - MIABIS-2.0-06.","","","","","","","","","","","","","","","","""eu_bbmri_eric_biobanks","it_support","it support","compound","","","TRUE","FALSE","","","","","FALSE","FALSE","FALSE","FALSE","FALSE","FALSE","","","","","","","","","","","","","","","","","","","","","""eu_bbmri_eric_biobanks","it_support_available","it support available","bool","","","TRUE","FALSE","","","","","FALSE","FALSE","FALSE","FALSE","TRUE","FALSE","it_support","","","","Is IT support available at the biobank?","","","","","","","","","","","","","","","","""eu_bbmri_eric_biobanks","it_staff_size","it staff size","int","","","TRUE","FALSE","","","","","FALSE","FALSE","FALSE","FALSE","TRUE","FALSE","it_support","","","","Size of the biobank dedicated IT staff measured as 2n.","","","","","","","","","","","","","","","","""eu_bbmri_eric_biobanks","is_available","is available","bool","","","TRUE","FALSE","","","","","FALSE","FALSE","FALSE","FALSE","TRUE","FALSE","it_support","","","","Has the biobank a computer-based Information System (IS)?","","","","","","","","","","","","","","","","""eu_bbmri_eric_biobanks","his_available","his available","bool","","","TRUE","FALSE","","","","","FALSE","FALSE","FALSE","FALSE","TRUE","FALSE","it_support","","","","Has the biobank on-line or off-line connection to a Hospital Information System (HIS)?","","","","","","","","","","","","","","","","""eu_bbmri_eric_biobanks","partner_charter_signed","partner charter signed","bool","","","FALSE","FALSE","","","","","FALSE","FALSE","FALSE","FALSE","TRUE","FALSE","","","","","Biobank has signed BBMRI-ERIC Partner Charter.","","","","","","","","","","","","","","","","""eu_bbmri_eric_biobanks","contact_information","contact information","compound","","","TRUE","FALSE","","","","","FALSE","FALSE","FALSE","FALSE","FALSE","FALSE","","","","","","","","","","","","","","","","","","","","","""eu_bbmri_eric_biobanks","head_firstname","head first name","string","","","TRUE","FALSE","","","","","FALSE","FALSE","FALSE","FALSE","TRUE","FALSE","contact_information","","","","First name of a person in charge of the biobank.","","","","","","","","","","","","","","","","""eu_bbmri_eric_biobanks","head_lastname","head last name","string","","","TRUE","FALSE","","","","","FALSE","FALSE","FALSE","FALSE","TRUE","FALSE","contact_information","","","","Last name of a person in charge of the biobank.","","","","","","","","","","","","","","","","""eu_bbmri_eric_biobanks","head_role","head role","string","","","TRUE","FALSE","","","","","FALSE","FALSE","FALSE","FALSE","FALSE","FALSE","contact_information","","","","Official role of the person in charge of the biobank: typically PI or Director.","","","","","","","","","","","","","","","","""eu_bbmri_eric_biobanks","contact","contact","xref","eu_bbmri_eric_persons","","TRUE","FALSE","","","","","FALSE","FALSE","FALSE","FALSE","TRUE","FALSE","","","","","Reference to a contact ID.","","","","","","","","","","","","","","","","""eu_bbmri_eric_biobanks","contact_priority","contact priority","int","","","FALSE","FALSE","","","","","FALSE","FALSE","FALSE","FALSE","FALSE","FALSE","contact_information","","","","Priority of the contact 1..n (i.e., non-negative integer), where the highest priority should be used for contacting about given set of samples. E.g., if a collection has contactPriority=3, the biobank in which the collection resides has contactPriority=10, and the biobankNetwork to which the collection or biobank belongs has contactPriority=7, the biobank contact should be used.","","","","","","","","","","","","","","","","""eu_bbmri_eric_biobanks","latitude","latitude","string","","","TRUE","FALSE","","","","","FALSE","FALSE","FALSE","FALSE","TRUE","FALSE","contact_information","","","","Latitude of the biobank in the WGS84 system (the one used by GPS), positive is northern hemisphere.","","","","","","","","","","","","","","","","""eu_bbmri_eric_biobanks","longitude","longitude","string","","","TRUE","FALSE","","","","","FALSE","FALSE","FALSE","FALSE","FALSE","FALSE","contact_information","","","","Longitude of the biobank in the WGS84 system (the one used by GPS), positive is to the East of Greenwich.","","","","","","","","","","","","","","","","""eu_bbmri_eric_biobanks","collections","collections","one_to_many","eu_bbmri_eric_collections","biobank","","","","","","","","","","","","","","","","","","","","","","","","","","","","","","","","","""eu_bbmri_eric_biobanks","network","network","mref","eu_bbmri_eric_networks","","TRUE","FALSE","","","","","FALSE","FALSE","FALSE","FALSE","FALSE","FALSE","","","","","Reference to a biobank network ID, to which the collection or biobank belongs; this attribute can also be used for biobank network, where it refers to the superior biobank network).","","","","","","","","","","","","","","","","""eu_bbmri_eric_biobanks","collaboration_commercial","collaboration commercial","bool","","","TRUE","FALSE","","","","","FALSE","FALSE","FALSE","FALSE","TRUE","FALSE","","","","","Biobank/collection can be used for collaboration with commercial partners.","","","","","","","","","","","","","","","","""eu_bbmri_eric_biobanks","collaboration_non_for_profit","collaboration non for profit","bool","","","TRUE","FALSE","","","","","FALSE","FALSE","FALSE","FALSE","TRUE","FALSE","","","","","Biobank/collection can be used for collaboration with non-for-profit partners.","","","","","","","","","","","","","","","","""eu_bbmri_eric_biobanks","capabilities","Capablities provided","categorical_mref","eu_bbmri_eric_capabilities","","TRUE","FALSE","","","","","FALSE","FALSE","FALSE","FALSE","TRUE","FALSE","","","","","Capabilities that the biobank organisation can offer to a researcher","","","","","","","","","","","","","","","","""eu_bbmri_eric_biobanks","operational_standards","Applied operational standards","categorical_mref","eu_bbmri_eric_ops_standards","","TRUE","FALSE","","","","","FALSE","FALSE","FALSE","FALSE","TRUE","FALSE","","","","","Biobank/collection can be used for collaboration with non-for-profit partners.","","","","","","","","","","","","","","","","""eu_bbmri_eric_biobanks","other_standards","Other operational standards","string","","","TRUE","FALSE","","","","","FALSE","FALSE","FALSE","FALSE","FALSE","FALSE","","","","","Other standards that the biobank complies with (please specify)","","","","","","","","","","","","","","","","""eu_bbmri_eric_collections","id","id","string","","","FALSE","TRUE","","","","","TRUE","FALSE","TRUE","FALSE","FALSE","TRUE","","","","","Unique collection ID within BBMRI-ERIC based on MIABIS 2.0 standard, constructed from biobankID prefix + :collection: + local collection ID string - MIABIS-2.0-01.","","","","","","","","","","","","","","","","""eu_bbmri_eric_collections","country","country","categorical","eu_bbmri_eric_countries","","FALSE","FALSE","","","","","FALSE","FALSE","FALSE","TRUE","TRUE","FALSE","","","","","Country according to MIABIS 2.0 - MIABIS-2.0-07-H.","","","","","","","","","","","","","","","","""eu_bbmri_eric_collections","biobank","biobank","xref","eu_bbmri_eric_biobanks","","FALSE","FALSE","","","","","FALSE","FALSE","FALSE","TRUE","TRUE","FALSE","","","","","Reference to a biobank ID, to which the collection belongs.","","","","","","","","","","","","","","","","""eu_bbmri_eric_collections","collection","collection","compound","","","TRUE","FALSE","","","","","FALSE","FALSE","FALSE","FALSE","TRUE","FALSE","","","","","","","","","","","","","","","","","","","","","""eu_bbmri_eric_collections","name","collection name","string","","","FALSE","FALSE","","","","","FALSE","TRUE","FALSE","FALSE","TRUE","FALSE","collection","","","","Collection name according to MIABIS 2.0 - MIABIS-2.0-03.","","","","","","","","","","","","","","","","""eu_bbmri_eric_collections","acronym","collection acronym","string","","","TRUE","FALSE","","","","","FALSE","FALSE","FALSE","FALSE","TRUE","FALSE","collection","","","","Collection acronym according to MIABIS 2.0 - MIABIS-2.0-02.","","","","","","","","","","","","","","","","""eu_bbmri_eric_collections","description","description","text","","","TRUE","FALSE","","","","","FALSE","FALSE","FALSE","FALSE","FALSE","FALSE","collection","","","","Collection description according to MIABIS 2.0 - MIABIS-2.0-08.","","","","","","","","","","","","","","","","""eu_bbmri_eric_collections","bioresource_reference","bioresource reference","text","","","TRUE","FALSE","","","","","FALSE","FALSE","FALSE","FALSE","FALSE","FALSE","collection","","","","Bioresource reference to be cited when the bioresource (biobank/collection) is used for research.","","","","","","","","","","","","","","","","""eu_bbmri_eric_collections","parent_collection","parent collection","xref","eu_bbmri_eric_collections","","TRUE","FALSE","","","","","FALSE","FALSE","FALSE","FALSE","FALSE","FALSE","","","","","Reference to a collection ID, refers to the superior collection.","","","","","","","","","","","","","","","","""eu_bbmri_eric_collections","sub_collections","sub collections","one_to_many","eu_bbmri_eric_collections","parent_collection","","","","","","","","","","","","","","","","","","","","","","","","","","","","","","","","","""eu_bbmri_eric_collections","network","network","mref","eu_bbmri_eric_networks","","TRUE","FALSE","","","","","FALSE","FALSE","FALSE","FALSE","TRUE","FALSE","collection","","","","Reference to a biobank network ID, to which the collection or biobank belongs; this attribute can also be used for biobank network, where it refers to the superior biobank network).","","","","","","","","","","","","","","","","""eu_bbmri_eric_collections","type","type","categorical_mref","eu_bbmri_eric_collection_types","","FALSE","FALSE","","","","","FALSE","FALSE","FALSE","TRUE","TRUE","FALSE","collection","","","","Type(s) of collection - MIABIS-2.0-19.","","","","","","","","","","","","","","","","""eu_bbmri_eric_collections","data_categories","data categories","categorical_mref","eu_bbmri_eric_data_types","","FALSE","FALSE","","","","","FALSE","FALSE","FALSE","TRUE","TRUE","FALSE","collection","","","","Denotes which types of data are available (MIABIS-2.0-13).","","","","","","","","","","","","","","","","""eu_bbmri_eric_collections","standards","standards","categorical_mref","eu_bbmri_eric_lab_standards","","TRUE","FALSE","","","","","FALSE","FALSE","FALSE","FALSE","FALSE","FALSE","collection","","","","List of standards to which the collection complies","","","","","","","","","","","","","","","","""eu_bbmri_eric_collections","order_of_magnitude","order of magnitude","categorical","eu_bbmri_eric_biobank_size","","FALSE","FALSE","","","","","FALSE","FALSE","FALSE","TRUE","FALSE","FALSE","collection","","","","Size of the collection measured as 10n samples.","","","","","","","","","","","","","","","","""eu_bbmri_eric_collections","size","size","int","","","TRUE","FALSE","","","","","FALSE","FALSE","FALSE","FALSE","FALSE","FALSE","collection","","","","Exact size of the collection to the given date.","","","","","","","","","","","","","","","","""eu_bbmri_eric_collections","timestamp","timestamp","date_time","","","TRUE","FALSE","","","","","FALSE","FALSE","FALSE","FALSE","FALSE","FALSE","collection","","","","Date to which the size of the collection was valid, format: yyyy-mm-ddThh:mm:ss+nnnn, e.g. 2016-11-15T09:53:13+0100.","","","","","","","","","","","","","","","","""eu_bbmri_eric_collections","id_card","Link to RD-Connect ID-Card","hyperlink","","","TRUE","FALSE","","","","","FALSE","FALSE","FALSE","FALSE","FALSE","FALSE","","","","","","","","","","","","","","","","","","","","","""eu_bbmri_eric_collections","contact_information","contact information","compound","","","TRUE","FALSE","","","","","FALSE","FALSE","FALSE","FALSE","FALSE","FALSE","","","","","","","","","","","","","","","","","","","","","""eu_bbmri_eric_collections","head_firstname","head first name","string","","","TRUE","FALSE","","","","","FALSE","FALSE","FALSE","FALSE","TRUE","FALSE","contact_information","","","","First name of a person in charge of the collection.","","","","","","","","","","","","","","","","""eu_bbmri_eric_collections","head_lastname","head last name","string","","","TRUE","FALSE","","","","","FALSE","FALSE","FALSE","FALSE","TRUE","FALSE","contact_information","","","","Last name of a person in charge of the collection.","","","","","","","","","","","","","","","","""eu_bbmri_eric_collections","head_role","head role","string","","","TRUE","FALSE","","","","","FALSE","FALSE","FALSE","FALSE","FALSE","FALSE","contact_information","","","","Official role of the person in charge of the collection: typically PI or Director.","","","","","","","","","","","","","","","","""eu_bbmri_eric_collections","contact","contact","xref","eu_bbmri_eric_persons","","TRUE","FALSE","","","","","FALSE","FALSE","FALSE","FALSE","FALSE","FALSE","","","","","Reference to a contact ID.","","","","","","","","","","","","","","","","""eu_bbmri_eric_collections","contact_priority","contact priority","int","","","FALSE","FALSE","","1","","","FALSE","FALSE","FALSE","FALSE","FALSE","FALSE","contact_information","","","","Priority of the contact 1..n (i.e., non-negative integer), where the highest priority should be used for contacting about given set of samples. E.g., if a collection has contactPriority=3, the biobank in which the collection resides has contactPriority=10, and the biobankNetwork to which the collection or biobank belongs has contactPriority=7, the biobank contact should be used.","","","","","","","","","","","","","","","","""eu_bbmri_eric_collections","latitude","latitude","string","","","TRUE","FALSE","","","","","FALSE","FALSE","FALSE","FALSE","FALSE","FALSE","contact_information","","","","Latitude of the biobank in the WGS84 system (the one used by GPS), positive is northern hemisphere.","","","","","","","","","","","","","","","","""eu_bbmri_eric_collections","longitude","longitude","string","","","TRUE","FALSE","","","","","FALSE","FALSE","FALSE","FALSE","FALSE","FALSE","contact_information","","","","Longitude of the biobank in the WGS84 system (the one used by GPS), positive is to the East of Greenwich.","","","","","","","","","","","","","","","","""eu_bbmri_eric_collections","donor_data","donor data","compound","","","TRUE","FALSE","","","","","FALSE","FALSE","FALSE","FALSE","FALSE","FALSE","","","","","","","","","","","","","","","","","","","","","""eu_bbmri_eric_collections","sex","sex","categorical_mref","eu_bbmri_eric_sex_types","","TRUE","FALSE","","","","","FALSE","FALSE","FALSE","FALSE","TRUE","FALSE","donor_data","","","","The sex of the individuals in the sample collection. - MIABIS-2.0-09.","","","","","","","","","","","","","","","","""eu_bbmri_eric_collections","diagnosis_available","diagnosis available","mref","eu_bbmri_eric_disease_types","","TRUE","FALSE","","","","","FALSE","FALSE","FALSE","FALSE","TRUE","FALSE","donor_data","","","","Diagnosis available in the collection, with the ontology prefix, possibly using * and ? wildcards, and prefix notation to denote diagnosis nomenclature - so far urn:miriam:icd: prefix for ICD-10, and urn:miriam:snomedct: prefix for SNOMED CT (examples being urn:miriam:icd:C*, urn:miriam:snomedct:25*) - MIABIS-2.0-17, adapted.","","","","","","","","","","","","","","","","""eu_bbmri_eric_collections","age_low","age low","int","","","TRUE","FALSE","","","0","120","FALSE","FALSE","FALSE","FALSE","TRUE","FALSE","donor_data","","","","Age of youngest sample donor at time of sample donation - MIABIS-2.0-10.","","","","","","","","","","","","","","","","""eu_bbmri_eric_collections","age_high","age high","int","","","TRUE","FALSE","","","0","120","FALSE","FALSE","FALSE","FALSE","TRUE","FALSE","donor_data","","","","Age of oldest sample donor at time of sample donation - MIABIS-2.0-11.","","","","","","","","","","","","","","","","""eu_bbmri_eric_collections","age_unit","age unit","categorical_mref","eu_bbmri_eric_age_units","","TRUE","FALSE","","","","","FALSE","FALSE","FALSE","FALSE","FALSE","FALSE","donor_data","","","","Unit defining Age Low and Age High. Can be one of the following values: years, months, weeks, days - MIABIS-2.0-08.","","","","","","","","","","","","","","","","""eu_bbmri_eric_collections","imaging_data","imaging data","compound","","","TRUE","FALSE","","","","","FALSE","FALSE","FALSE","FALSE","FALSE","FALSE","","","","","","","","","","","","","","","","","","","","","""eu_bbmri_eric_collections","body_part_examined","body part examined","mref","eu_bbmri_eric_body_parts","","TRUE","FALSE","","","","","FALSE","FALSE","FALSE","FALSE","TRUE","FALSE","imaging_data","","","","The examined body part(s).","","","","","","","","","","","","","","","","""eu_bbmri_eric_collections","imaging_modality","imaging modality","mref","eu_bbmri_eric_imaging_modality","","TRUE","FALSE","","","","","FALSE","FALSE","FALSE","FALSE","TRUE","FALSE","imaging_data","","","","The imaging modality/modalities.","","","","","","","","","","","","","","","","""eu_bbmri_eric_collections","image_dataset_type","image dataset type","mref","eu_bbmri_eric_image_data_types","","TRUE","FALSE","","","","","FALSE","FALSE","FALSE","FALSE","TRUE","FALSE","imaging_data","","","","Type(s) of the imaging dataset.","","","","","","","","","","","","","","","","""eu_bbmri_eric_collections","sample_data","sample data","compound","","","TRUE","FALSE","","","","","FALSE","FALSE","FALSE","FALSE","FALSE","FALSE","","","","","","","","","","","","","","","","","","","","","""eu_bbmri_eric_collections","materials","materials","categorical_mref","eu_bbmri_eric_material_types","","TRUE","FALSE","","","","","FALSE","FALSE","FALSE","FALSE","TRUE","FALSE","sample_data","","","","Collection contains material(s) of this/these type(s) (MIABIS-2.0-14).","","","","","","","","","","","","","","","","""eu_bbmri_eric_collections","storage_temperatures","storage temperatures","categorical_mref","eu_bbmri_eric_temp_types","","TRUE","FALSE","","","","","FALSE","FALSE","FALSE","FALSE","TRUE","FALSE","sample_data","","","","Sample storage temperature(s) - SPREC 2.0 (MIABIS-2.0-15).","","","","","","","","","","","","","","","","""eu_bbmri_eric_collections","access_policy","access policy","compound","","","TRUE","FALSE","","","","","FALSE","FALSE","FALSE","FALSE","FALSE","FALSE","","","","","","","","","","","","","","","","","","","","","""eu_bbmri_eric_collections","sample_access_fee","sample access fee","bool","","","TRUE","FALSE","","","","","FALSE","FALSE","FALSE","FALSE","TRUE","FALSE","access_policy","","","","Denotes whether access to samples may be obtained on fee-based basis.","","","","","","","","","","","","","","","","""eu_bbmri_eric_collections","sample_access_joint_project","sample access joint project","bool","","","TRUE","FALSE","","","","","FALSE","FALSE","FALSE","FALSE","TRUE","FALSE","access_policy","","","","Denotes whether access to samples may be obtained on joint project basis.","","","","","","","","","","","","","","","","""eu_bbmri_eric_collections","sample_access_description","sample access description","text","","","TRUE","FALSE","","","","","FALSE","FALSE","FALSE","FALSE","FALSE","FALSE","access_policy","","","","Short description of access rules.","","","","","","","","","","","","","","","","""eu_bbmri_eric_collections","sample_access_uri","sample access uri","hyperlink","","","TRUE","FALSE","","","","","FALSE","FALSE","FALSE","FALSE","FALSE","FALSE","access_policy","","","","URI describing access policy for the samples.","","","","","","","","","","","","","","","","""eu_bbmri_eric_collections","data_access_fee","data access fee","bool","","","TRUE","FALSE","","","","","FALSE","FALSE","FALSE","FALSE","TRUE","FALSE","access_policy","","","","Denotes whether access to data may be obtained on fee-based basis.","","","","","","","","","","","","","","","","""eu_bbmri_eric_collections","data_access_joint_project","data access joint project","bool","","","TRUE","FALSE","","","","","FALSE","FALSE","FALSE","FALSE","TRUE","FALSE","access_policy","","","","Denotes whether access to data may be obtained on joint project basis.","","","","","","","","","","","","","","","","""eu_bbmri_eric_collections","data_access_description","data access description","text","","","TRUE","FALSE","","","","","FALSE","FALSE","FALSE","FALSE","FALSE","FALSE","access_policy","","","","Short description of access rules.","","","","","","","","","","","","","","","","""eu_bbmri_eric_collections","data_access_uri","data access uri","hyperlink","","","TRUE","FALSE","","","","","FALSE","FALSE","FALSE","FALSE","FALSE","FALSE","access_policy","","","","URI describing access policy for the data.","","","","","","","","","","","","","","","","""eu_bbmri_eric_collections","image_access_fee","image access fee","bool","","","TRUE","FALSE","","","","","FALSE","FALSE","FALSE","FALSE","TRUE","FALSE","access_policy","","","","Denotes whether access to images may be obtained on fee-based basis.","","","","","","","","","","","","","","","","""eu_bbmri_eric_collections","image_joint_projects","image joint projects","bool","","","TRUE","FALSE","","","","","FALSE","FALSE","FALSE","FALSE","TRUE","FALSE","access_policy","","","","Denotes whether access to images may be obtained on joint project basis.","","","","","","","","","","","","","","","","""eu_bbmri_eric_collections","image_access_description","image access description","text","","","TRUE","FALSE","","","","","FALSE","FALSE","FALSE","FALSE","FALSE","FALSE","access_policy","","","","Short description of access rules.","","","","","","","","","","","","","","","","""eu_bbmri_eric_collections","image_access_uri","image access uri","hyperlink","","","TRUE","FALSE","","","","","FALSE","FALSE","FALSE","FALSE","FALSE","FALSE","access_policy","","","","URI describing access policy for the images.","","","","","","","","","","","","","","","","""eu_bbmri_eric_collections","collaboration_commercial","collaboration commercial","bool","","","TRUE","FALSE","","","","","FALSE","FALSE","FALSE","FALSE","TRUE","FALSE","access_policy","","","","Biobank/collection can be used for collaboration with commercial partners.","","","","","","","","","","","","","","","","""eu_bbmri_eric_collections","collaboration_non_for_profit","collaboration non for profit","bool","","","TRUE","FALSE","","","","","FALSE","FALSE","FALSE","FALSE","TRUE","FALSE","access_policy","","","","Biobank/collection can be used for collaboration with non-for-profit partners.","","","","","","","","","","","","","","","","""eu_bbmri_eric_collections","sample_mgmt","sample management","compound","","","TRUE","FALSE","","","","","FALSE","FALSE","FALSE","FALSE","FALSE","FALSE","","","","","","","","","","","","","","","","","","","","",""